{"$schema":"https://json-schema.org/draft/2020-12/schema","$id":"https://grandchallenge.ai/schemas/openai_ten_proofs_route_proposal_registry.schema.json","title":"OpenAI Ten Proofs Route Proposal Registry","type":"object","additionalProperties":false,"required":["schema_version","record_type","record_id","candidate_id","tracker_issue","authority","state","proposals","blocked_repair_lanes","unexamined_result_family_count","aggregate_integration","route_controls","activation","claim_boundary"],"properties":{"schema_version":{"const":"1.0.0"},"record_type":{"const":"openai_ten_proofs_route_proposal_registry"},"record_id":{"const":"MC-OPENAI-TEN-PROOFS-WP05-ROUTE-PROPOSALS"},"candidate_id":{"const":"OPENAI-TEN-PROOFS-001"},"tracker_issue":{"const":"https://github.com/grandchallenge/MATHCERT/issues/53"},"authority":{"type":"object","additionalProperties":false,"required":["cert_replay_evidence_merge","forge_source_revision_audit_merge","forge_provider_manifest_merge","source_revision_audit_blob","provider_manifest_blob","global_registered_route_registry_blob"],"properties":{"cert_replay_evidence_merge":{"$ref":"#/$defs/sha40"},"forge_source_revision_audit_merge":{"$ref":"#/$defs/sha40"},"forge_provider_manifest_merge":{"$ref":"#/$defs/sha40"},"source_revision_audit_blob":{"$ref":"#/$defs/sha40"},"provider_manifest_blob":{"$ref":"#/$defs/sha40"},"global_registered_route_registry_blob":{"$ref":"#/$defs/sha40"}}},"state":{"type":"object","additionalProperties":false,"required":["proposal_count","registered_route_count","adjudication_count","cert_output_count","mathematical_target_proved_count","aggregate_route_count"],"properties":{"proposal_count":{"const":3},"registered_route_count":{"const":0},"adjudication_count":{"const":0},"cert_output_count":{"const":0},"mathematical_target_proved_count":{"const":0},"aggregate_route_count":{"const":0}}},"proposals":{"type":"array","minItems":3,"maxItems":3,"items":{"type":"object","additionalProperties":false,"required":["result_family","proposal_id","requested_route_id","path","digest_algorithm","digest"],"properties":{"result_family":{"enum":["OTP-F-EHRHART","OTP-J1-COMPACTNESS","OTP-J2-TWO-DEGENERATE"]},"proposal_id":{"type":"string","pattern":"^MC-OTP-ROUTE-PROPOSAL-[A-Z0-9-]+$"},"requested_route_id":{"type":"string","pattern":"^MC-ROUTE-OTP-[A-Z0-9-]+$"},"path":{"type":"string","minLength":1},"digest_algorithm":{"const":"git_blob_sha1"},"digest":{"$ref":"#/$defs/sha40"}}}},"blocked_repair_lanes":{"type":"array","const":["OTP-C-PERMANENT","OTP-H-GAPCVP"]},"unexamined_result_family_count":{"const":9},"aggregate_integration":{"type":"object","additionalProperties":false,"required":["all_lean_state","reopens_family_replay","creates_route","creates_adjudication"],"properties":{"all_lean_state":{"const":"failed_namespace_collision"},"reopens_family_replay":{"const":false},"creates_route":{"const":false},"creates_adjudication":{"const":false}}},"route_controls":{"type":"object","additionalProperties":false,"required":["global_registered_route_registry_modified","proposal_registry_separate","may_register_route","may_adjudicate","may_issue_cert_output","may_mark_target_proved","aggregate_route_prohibited","may_promote_claim"],"properties":{"global_registered_route_registry_modified":{"const":false},"proposal_registry_separate":{"const":true},"may_register_route":{"const":false},"may_adjudicate":{"const":false},"may_issue_cert_output":{"const":false},"may_mark_target_proved":{"const":false},"aggregate_route_prohibited":{"const":true},"may_promote_claim":{"const":false}}},"activation":{"type":"object","additionalProperties":false,"required":["condition","head_change_requires_reapproval","effect"],"properties":{"condition":{"type":"string","minLength":40},"head_change_requires_reapproval":{"const":true},"effect":{"const":"three_route_proposals_admitted_no_registration_no_adjudication"}}},"claim_boundary":{"type":"string","minLength":250}},"$defs":{"sha40":{"type":"string","pattern":"^[0-9a-f]{40}$"}}}
